[
  {
    "id": "music-2022-08-01-attention-debut-single",
    "date": "2022-08-01",
    "date_type": "release",
    "date_precision": "day",
    "category": "music",
    "entity": "newjeans",
    "members": [
      "all"
    ],
    "title": {
      "ja": "Attention（デビュー曲）",
      "en": "Attention (debut single)",
      "original": "Attention"
    },
    "summary": {
      "ja": "1st EP『New Jeans』の1曲目を飾るデビュー曲。MVは事前告知なしに7月22日に先行公開された。",
      "en": "Debut track that opens the 1st EP New Jeans; its music video dropped on 22 July with no prior announcement."
    },
    "source_url": "https://music.apple.com/kr/album/newjeans-1st-ep-new-jeans/1635469682",
    "reference_urls": [
      "https://en.wikipedia.org/wiki/Attention_(NewJeans_song)",
      "https://en.wikipedia.org/wiki/NewJeans_discography",
      "https://ko.wikipedia.org/wiki/%EB%89%B4%EC%A7%84%EC%8A%A4"
    ],
    "media": {
      "type": "none"
    },
    "tags": [
      "single",
      "debut"
    ],
    "verified": true,
    "editor_note": "MV/video premiered 2022-07-22 KST; full digital download/streaming started 2022-08-01 with the EP. | Tag 'ep-new-jeans' removed from reader-facing tags: the EP title was not public until the 2022-07-25 pre-order. | moved from 2022-07-22 (MV premiere) to streaming release 2022-08-01: Moved from 2022-07-22. 07-22 00:00 KST was the surprise MV premiere only (isplus/newsis). Audio was NOT on streaming that day: Apple Music KR datePublished 2022-08-01 and Melon album 11011565 date 2022.08.01; EP went live 18:00 KST Aug 1 (isplus 2022-08-04). The Spotify \"Attention\" entry dated 2022-07-22 (album 0gtYJ4BxqMs2xYXVQjn14J) is a music-video entry, not audio. | Credits from en.wikipedia Attention_(NewJeans_song) and New_Jeans_(EP); distributor from namu.wiki New Jeans(음반).",
    "links": {
      "spotify": "https://open.spotify.com/track/2pIUpMhHL6L9Z5lnKxJJr9",
      "apple_music": "https://music.apple.com/kr/album/newjeans-1st-ep-new-jeans/1635469682",
      "melon": "https://www.melon.com/song/detail.htm?songId=35454425",
      "spotify_album": "https://open.spotify.com/album/1HMLpmZAnNyl9pxvOnTovV"
    },
    "image": {
      "url": "https://is1-ssl.mzstatic.com/image/thumb/Music112/v4/4e/64/34/4e64344b-3ac6-c503-2c41-257a15401416/192641873096_Cover.jpg/1000x1000bb.jpg",
      "source_url": "https://music.apple.com/kr/album/newjeans-1st-ep-new-jeans/1635469682"
    },
    "time": "18:00",
    "note": "MVは7月22日に先行公開。",
    "note_en": "The MV was released early, on July 22.",
    "detail": {
      "ja": "1st EP『New Jeans』の1曲目に収録されたデビュー曲で、8月1日18時にEPと同時に配信が始まった。収録時間は3分00秒。作詞はGigi、Duckbay、ダニエル、作曲は250とDuckbay、編曲とプロデュースは250。ボーカルディレクションはJungwoo Jang、ミックスはTony MaseratiとDavid K. Younghyun、録音はHYBE Studio。ミュージックビデオは7月22日0時に事前告知なしで公開されており、レーベルはADOR、流通はYG PLUS。",
      "en": "Debut track and track 1 of the 1st EP New Jeans, released for download and streaming at 18:00 KST on 1 August together with the EP. Running time 3:00. Lyrics by Gigi, Duckbay and Danielle; music by 250 and Duckbay; arranged and produced by 250. Vocal direction by Jungwoo Jang, mixing by Tony Maserati and David K. Younghyun, recorded at HYBE Studio. The music video had premiered without announcement on 22 July at 00:00 KST. Released by ADOR, distributed by YG PLUS."
    },
    "credits": {
      "lyricist": "Gigi, Duckbay, Danielle",
      "composer": "250, Duckbay",
      "arranger": "250",
      "producer": "250",
      "executive_producer": "Min Hee-jin",
      "vocal_director": "Jungwoo Jang",
      "mixing": "Tony Maserati, David K. Younghyun",
      "label": "ADOR",
      "distributor": "YG PLUS",
      "length": "3:00"
    }
  },
  {
    "id": "music-2022-08-01-cookie",
    "date": "2022-08-01",
    "date_type": "release",
    "date_precision": "day",
    "category": "music",
    "entity": "newjeans",
    "members": [
      "all"
    ],
    "title": {
      "ja": "Cookie",
      "en": "Cookie",
      "original": "Cookie"
    },
    "summary": {
      "ja": "デビューEPの3つのタイトル曲のうち最後に公開された曲。MVはカウントダウンライブの最中に初公開された。",
      "en": "The last of the debut EP's three title tracks to be unveiled; its music video premiered in the middle of the countdown live."
    },
    "source_url": "https://music.apple.com/kr/album/newjeans-1st-ep-new-jeans/1635469682",
    "reference_urls": [
      "https://en.wikipedia.org/wiki/Cookie_(NewJeans_song)",
      "https://en.wikipedia.org/wiki/NewJeans_discography"
    ],
    "media": {
      "type": "none"
    },
    "tags": [
      "single",
      "ep-new-jeans"
    ],
    "verified": true,
    "links": {
      "spotify": "https://open.spotify.com/track/2DwUdMJ5uxv20EhAildreg",
      "apple_music": "https://music.apple.com/kr/album/newjeans-1st-ep-new-jeans/1635469682",
      "melon": "https://www.melon.com/song/detail.htm?songId=35485544",
      "spotify_album": "https://open.spotify.com/album/1HMLpmZAnNyl9pxvOnTovV"
    },
    "image": {
      "url": "https://is1-ssl.mzstatic.com/image/thumb/Music112/v4/4e/64/34/4e64344b-3ac6-c503-2c41-257a15401416/192641873096_Cover.jpg/1000x1000bb.jpg",
      "source_url": "https://music.apple.com/kr/album/newjeans-1st-ep-new-jeans/1635469682"
    },
    "time": "18:00",
    "editor_note": "Confirmed: released with the EP 2022-08-01 18:00 KST (Apple Music KR datePublished 2022-08-01; Melon 2022.08.01; isplus \"1일 오후 6시\"). Cookie MV also dropped Aug 1. | Credits from en.wikipedia Cookie_(NewJeans_song) and namu.wiki Cookie(NewJeans); MV director from YouTube description.",
    "detail": {
      "ja": "1st EP『New Jeans』の3曲目で、3つのタイトル曲のうち最後に公開された。EPとともに18時に配信が始まり、同時刻のカウントダウンライブ中にDongle Shin監督のミュージックビデオが公開された。収録時間は3分55秒。作詞はGigiとYlva Dimberg、作曲はPark Jin-su（FRNK）とYlva Dimberg、編曲とプロデュースはPark Jin-su。レーベルはADOR、流通はYG PLUS。",
      "en": "Track 3 of the 1st EP New Jeans and the last of its three title tracks to be unveiled. Streaming began at 18:00 KST with the EP, and the music video, directed by Dongle Shin, premiered during the countdown live held at the same hour. Running time 3:55. Lyrics by Gigi and Ylva Dimberg; music by Park Jin-su (FRNK) and Ylva Dimberg; arranged and produced by Park Jin-su. Released by ADOR, distributed by YG PLUS."
    },
    "credits": {
      "lyricist": "Gigi, Ylva Dimberg",
      "composer": "Park Jin-su (FRNK), Ylva Dimberg",
      "arranger": "Park Jin-su (FRNK)",
      "producer": "Park Jin-su (FRNK)",
      "executive_producer": "Min Hee-jin",
      "mv_director": "Dongle Shin",
      "label": "ADOR",
      "distributor": "YG PLUS",
      "length": "3:55"
    }
  },
  {
    "id": "music-2022-08-01-hype-boy",
    "date": "2022-08-01",
    "date_type": "release",
    "date_precision": "day",
    "category": "music",
    "entity": "newjeans",
    "members": [
      "all"
    ],
    "title": {
      "ja": "Hype Boy",
      "en": "Hype Boy",
      "original": "Hype Boy"
    },
    "summary": {
      "ja": "デビューEPの2番目のタイトル曲。イントロ映像とメンバー別4バージョンのMVが7月23日に先行公開された。",
      "en": "Second title track of the debut EP; an intro clip and four member-focused music videos had arrived on 23 July."
    },
    "source_url": "https://music.apple.com/kr/album/newjeans-1st-ep-new-jeans/1635469682",
    "reference_urls": [
      "https://en.wikipedia.org/wiki/Hype_Boy",
      "https://en.wikipedia.org/wiki/NewJeans_discography",
      "https://ko.wikipedia.org/wiki/%EB%89%B4%EC%A7%84%EC%8A%A4"
    ],
    "media": {
      "type": "none"
    },
    "tags": [
      "single"
    ],
    "verified": true,
    "editor_note": "Unveiled via MV 2022-07-23; digital streaming started 2022-08-01 with the EP. | Tag 'ep-new-jeans' removed from reader-facing tags: the EP title was not public until the 2022-07-25 pre-order. | moved from 2022-07-23 (MV premiere) to streaming release 2022-08-01: Moved from 2022-07-23. 07-23 was the MV unveiling (4 versions) only; audio streaming started 2022-08-01 18:00 KST with the EP (Apple Music KR datePublished 2022-08-01; Melon 2022.08.01). | Credits from en.wikipedia Hype_Boy and New_Jeans_(EP). Summary's 'five MV versions' counts the intro clip plus four member versions.",
    "links": {
      "spotify": "https://open.spotify.com/track/0a4MMyCrzT0En247IhqZbD",
      "apple_music": "https://music.apple.com/kr/album/newjeans-1st-ep-new-jeans/1635469682",
      "melon": "https://www.melon.com/song/detail.htm?songId=35454426",
      "spotify_album": "https://open.spotify.com/album/1HMLpmZAnNyl9pxvOnTovV"
    },
    "image": {
      "url": "https://is1-ssl.mzstatic.com/image/thumb/Music112/v4/4e/64/34/4e64344b-3ac6-c503-2c41-257a15401416/192641873096_Cover.jpg/1000x1000bb.jpg",
      "source_url": "https://music.apple.com/kr/album/newjeans-1st-ep-new-jeans/1635469682"
    },
    "time": "18:00",
    "note": "MVは7月23日に先行公開。",
    "note_en": "The MV was released early, on July 23.",
    "detail": {
      "ja": "1st EP『New Jeans』の2曲目にして2番目のタイトル曲で、EPとともに18時に配信された。収録時間は2分59秒で、作詞はGigi、Ylva Dimberg、ハニ、作曲は250とYlva Dimberg、編曲とプロデュースは250。ミュージックビデオは7月23日にイントロ映像とメンバー別4バージョン（MINJI、HANNI、DANIELLE&HAERIN、HYEIN）が公開されており、どのバージョンもメンバーがプールパーティーに相手を招くという設定を共有する。レーベルはADOR、流通はYG PLUS。",
      "en": "Track 2 and second title track of the 1st EP New Jeans, released for streaming at 18:00 KST with the EP. Running time 2:59; lyrics by Gigi, Ylva Dimberg and Hanni, music by 250 and Ylva Dimberg, arranged and produced by 250. On 23 July an intro clip and four member-focused music videos (MINJI, HANNI, DANIELLE&HAERIN, HYEIN) had been released, all sharing a premise in which the members invite a boy to a pool party. Released by ADOR, distributed by YG PLUS."
    },
    "credits": {
      "lyricist": "Gigi, Ylva Dimberg, Hanni",
      "composer": "250, Ylva Dimberg",
      "arranger": "250",
      "producer": "250",
      "executive_producer": "Min Hee-jin",
      "label": "ADOR",
      "distributor": "YG PLUS",
      "length": "2:59"
    }
  },
  {
    "id": "music-2022-08-01-new-jeans-ep",
    "date": "2022-08-01",
    "date_type": "release",
    "date_precision": "day",
    "category": "music",